file_name,caption
000000104493.jpg,A busy recreational beach area under a blue sky.
000000081768.jpg,A busy down town area in a city.
000000537397.jpg,A helicopter is flying over the water near a large hill.
000000469410.jpg,A red park bench on grassy area next to a fence.
000000184980.jpg,A trolley stopped on a city street with pedestrians walking in front.
000000016513.jpg,A city bus drives through a neighborhood towards Heathrow Airport
000000532304.jpg,A traffic light suspended over a street below a mountain.
000000433297.jpg,A bus driving down a rural country road next to a forest.
000000492694.jpg,A red bus driving down a city street.
000000517405.jpg,This is a picture of a fire hydrant in a forest.
000000460728.jpg,a public transit bus on a city street covered in snow
000000531329.jpg,A view of a bus stop in the middle of a rural area.
000000324339.jpg,A white fire hydrant sitting in the middle of  dry grass field.
000000315348.jpg,A view of an intersection and a highway with neon lights on the ground.
000000439053.jpg,A view of a house from across the water.
000000206670.jpg,a black white and red jet grass and a runway
000000050463.jpg,A city bus driving on a busy street. 
000000026409.jpg,A big hotel in a very large and very busy city.
000000461687.jpg,a bench on a hill some grass mountains and trees
000000146388.jpg,A bench sitting on the beach in the middle of a lake.
000000408506.jpg,The city bus driving down a road is blue and white.
000000191972.jpg,A garden area with benches and beach umbrellas.
000000501874.jpg,Park benches in a flatened area of a forest
000000509677.jpg,Picnic tables are set out on the beach with a dock in the background.
000000444132.jpg,A snow covered area has trees and benches.
000000546561.jpg,an old bench on grass next to a tree and other plants
000000477417.jpg,Traffic lights on a city street near some buildings
000000434707.jpg,A modern commuter bus at a bus stop on a city street
000000160626.jpg,An aura be us flying given the sky and I ocean
000000293980.jpg,There us an image off the snow coveted mountains
000000459475.jpg,A large white boat floating on top of the ocean.
000000342591.jpg,A double decker green bus driving down a curvy road near  a lake.
000000125056.jpg,A tree in the middle of a grass area and a bench next to a railing area with a blue sky in the background.
000000324754.jpg,A double decker bus on a city street 
000000162598.jpg,View of a bench seated near rocks and bushes.
000000206871.jpg,A city street n Ealing with a bus in the foreground
000000159926.jpg,A city bus is traveling down the empty street.
000000580216.jpg,A bus is going around a corner in a city.
000000166126.jpg,View of traffic continuing on after a green light.
000000448061.jpg,The city street is not busy this time of day.
000000408303.jpg,Several cars are sitting at a red light in a city intersection.
000000117157.jpg,A city bus is traveling through the town.
000000551823.jpg,A red fire hydrant next to some tall grass and a metal post.
000000370926.jpg,"A long yellow school bus is parked on a city street.
"
000000104191.jpg,the woods are fully covered in snow so is the bench
000000570721.jpg,a public transit bus on a city street 
000000278043.jpg,A bench sitting in the middle of a tree filled forest.
000000537887.jpg,An overheard view of a street that has a stop light.
000000207811.jpg,A fire hydrant in the middle of a grassy area.
000000228566.jpg,A jetliner flying over a city under a cloudy sky.
000000251318.jpg,A city street filled with traffic driving past a light.
000000531146.jpg,A long white city bus driving down a street.
000000357289.jpg,Buses on a busy city street in daylight.
000000273001.jpg,A lady standing at the waters edge on steps leading to a lake.
000000050727.jpg,An oddly placed fire hydrant is in the middle of the forest.
000000059278.jpg,A blurry shot of a bunch of cards in a big city.
000000060433.jpg,A double decker bus pulling out in front of a grassy area.
000000225750.jpg,a dirt road a wooden bench some grass and trees
000000341922.jpg,A very modern European bus with a curved windshield on the street
000000126794.jpg,A green fire hydrant sits on a snow covered curb.
000000075474.jpg,A city street at night filled with lots of traffic.
000000023255.jpg,some grass a red fire hydrant and some water
000000502178.jpg,"There is a full view of an outdoor area and it is nice.
"
000000335405.jpg,"There is a full view of an outdoor area and it is nice.
"
000000052747.jpg,a street light sits next to a city street 
000000352980.jpg,Ominous clouds hover above the landscape in a major city.
000000292752.jpg,A sailboat near the shore of a lake.
000000093428.jpg,Grassy area with an old city in the background.
000000406657.jpg,A picture taken from the drivers seat of a car of the road ahead.
000000454892.jpg,A peaceful scene of a park bench sitting in a grassy meadow.
000000062477.jpg,A city stoplight in a downtown area of a city 
000000377301.jpg,Traffic signals displayed in large city with flag on pole in background.
000000392618.jpg,A blurry picture of a city street 
000000314420.jpg,This picture shows a busy city crosswalk scene.
000000535318.jpg,Wood and metal bench with snow all around.
000000230141.jpg,A car stopped at a stoplight while it snows.
000000555814.jpg,A stoplight at an intersection in a city. 
000000044540.jpg,A white bench that seats four in front of a wall with shrubs.
000000074328.jpg,A slate bench under trees in a forest as the sun rises
000000137748.jpg,A city street filled with traffic and traffic signals.
000000568884.jpg,Large red tow truck on roadway near large populated city area.
000000453332.jpg,A commuter bus and car traffic on an Australian city street
000000558436.jpg,A fire hyrdant in the middle of a grassy field.
000000378821.jpg,A blue double decker bus driving down a city street.
000000128264.jpg,The city bus is on the street in front of a large building. 
000000167603.jpg,A bus heads down a city street in the rain.
000000051322.jpg,a double decked bus drives down a city street 
000000573062.jpg,a black and white photo with some water plants grass and dirt 
000000284454.jpg,A city street with traffic line with lush green trees.
000000258792.jpg,The white city bus is parked near a parking lot.
000000416639.jpg,"A park covered in snow with a bench, trees, and neo-gothic architecture in the background."
000000509188.jpg,A bench is on a mowed section of grass next to a forest.
000000026943.jpg,A construction site at dusk under a cloudy sky.
000000409668.jpg,Traffic speeding by at night in a large city.
000000279708.jpg,Ram walking through parking lot near mountainous region.
000000223129.jpg,The city bus pulling into the street has another city bus behind it.
000000560046.jpg,The view from a vehicle of livestock in a field.
000000305705.jpg,A wooden bench sitting in a grass field.
000000413975.jpg,the street sign is on green and the sky is black 
000000459113.jpg,A metro bus driving through the city streets with buildings behind it.
000000377493.jpg,A large jetliner flying udner a cloudy sky.
000000259044.jpg,A traffic light hanging over a city street.
000000083125.jpg,An old fire hydrant on a snowy street.
000000415157.jpg,Livestock grazing in a grassy wooded field. 
000000019413.jpg,A large long bus on a city street.
000000006233.jpg,"A crowded city street with a building, cars and bicycles.  "
000000448358.jpg,The four engine airliner sits on the tarmac on a cloudy day.
000000012999.jpg,A single metal bench near a lake in autumn.
000000218906.jpg,A group of goats are walking along a snowy hill.
000000009640.jpg,Pair of geese in open grassy area on sunny day.
000000405430.jpg,A picture of a down town bus in front of a city block. 
000000113845.jpg,A view of a bunch of purple flower next to a fire hydrant.
000000039196.jpg,a wooden bench is sitting in a grassy area
000000060320.jpg,a city bus sits parked next to a tent 
000000166822.jpg,A large wooden bench in a grass field.
000000000943.jpg,A red fire hydrant and a sand sculpture on a beach.
000000240298.jpg,Red stop lights on a nearly empty city street.
000000081622.jpg,A view of street light from across the intersection. 
000000546279.jpg,A view of Kohl's from across an intersection.
000000032289.jpg,A view of a bench with a building behind it. The picture looks to be filtered. 
000000380714.jpg,"A view of a bunch of street lights, during a cloudy day."
000000377854.jpg,A blurry and out of focus picture of a busy city street.
000000533739.jpg,"Heavy traffic in a city with a ""Citi Bank"" building. "
000000560055.jpg,A double decker bus driving along a city street.
000000038681.jpg,A very busy city street with a multitude of streetlights and buildings in the background.
000000304238.jpg,A white and blue bench is sitting at this water overview.
000000427051.jpg,A red and yellow bus moves along a paved city road.
000000160812.jpg,a big pile of snow with a fire hydrant in it
000000403135.jpg,A scenic view of a park and the street next to it.
000000250677.jpg,Commuter bus on roadway in urban city on sunny day.
000000342932.jpg,Street lights and wires can be seen with a cloudy sky in the background.
000000300279.jpg,A view of traffic flowing through the street at night.
000000018439.jpg,A touring bus is shown with a mountain in the background.
000000113370.jpg,A white city bus pulling up to a bus stop.
000000294349.jpg,A close up of a fire hydrant on a snowy street
000000541251.jpg,A cable car is going through a city on its tracks.
000000546242.jpg,a bench at a train station with seating on the front and back 
000000563458.jpg,Large airliner flying against a sky with no clouds.
000000574922.jpg,A fire hydrant stands in a grass field
000000384598.jpg,a fire hydrant on a city street with a sky background
000000319899.jpg,Roadway intersection near large brick building in city.
000000570874.jpg,A bright red double decker bus moves down a city street.
000000167033.jpg,A yellow double decker bus making its way through the city streets.
000000027511.jpg,A yellow and blue bus driving down a city street.
000000060034.jpg,Pigeons bathe themselves in a puddle on a city street.
000000088931.jpg,City bus in San Antonio driving on busy street.
000000279605.jpg,A commercial jet flies through a partly cloudy sky.
000000484650.jpg,The city bus is painted pink and purple.
000000121938.jpg,Police investigating a bus crash on a city street.
000000046883.jpg,A close up image of a stop light in the middle of a city. 
000000564898.jpg,A group of black goats sitting on a grassy hill in the water. 
000000511537.jpg,a public transit bus on a city street 
000000116900.jpg,a public transit bus in a field with a sky background 
000000310216.jpg,Cars are waiting at a stop light in a big city.
000000185502.jpg,A yellow school bus stopped on a city road
000000361275.jpg,The plants are blowing in the wind near the ocean.
000000530655.jpg,The four engine airliner is flying above mountains.
000000478140.jpg,A city street with pedestrians crossing a rainy crosswalk.
000000251922.jpg,A blue city bus pulled up by the curb
000000353931.jpg,The street and traffic lights are blurred in this view.
000000566395.jpg,a number of cars on a city street with traffic lights 
000000346785.jpg,"A stoplight flashes yellow on a snow filled, empty street."
000000554994.jpg,A traffic signal sitting below a purple sky with a cloud.
000000366485.jpg,Shot of buildings in a big city with a deserted street.
000000343898.jpg,A grassy road is near a large bridge. 
000000042682.jpg,Busy city street with traffic and pedestrians at night.
000000102307.jpg,A car windshield that has a large number of raindrops on it.
000000147303.jpg,The city buses are parked together in the parking lot.
000000288453.jpg,A view of the bridge from a park with benches
000000541705.jpg,There is an empty lounge chair on the beach.
000000103498.jpg,"A view of an intersection, during a traffic riddled time."
000000025348.jpg,A fire hydrant is in the grass next to a picnic table. 
000000241076.jpg,A city bus has an ad on it while going down the street
000000460143.jpg,A red bus for Madrid city tours and a motorcycle
000000473420.jpg,A flock of pigeons on a traffic light post in the city.
000000082242.jpg,A city street clogged with buses stopping at a bus depot.
000000193785.jpg,A line of traffic lights hanging over a city street.
000000387379.jpg,a red  fire hydrant partially covered by the snow 
000000021374.jpg,A red double-decked bus is parked on a city street.
000000111406.jpg,A bus is stopped on the corner of a city street.
000000151499.jpg,A city bus drives along a street shaded by trees.
000000132523.jpg,a fire hydrant sitting in the grass with chains hanging from it
000000174462.jpg,Nighttime lights and traffic along a city street.
000000016113.jpg,A stop light is viewed from behind a dashboard. 
000000401362.jpg,Flowers bloom in the patchy grass near a painted fire hydrant.
000000444340.jpg,A yellow fire hydrant covered in snow near concrete steps.
000000143277.jpg,A bus in the middle of a city street.
000000428605.jpg,a red and white fire hydrogn in a grassy field
000000019828.jpg,A very dark city with traffic and a light that is red.
000000420496.jpg,"A city highway at night with street lights, car lights and building lights all around. "
000000119016.jpg,A city scene at nighttime the streetlight is green. 
000000447769.jpg,The entrance to a city park featuring colorful flags on poles.
000000084499.jpg,A bull is walking down a city street.
000000223497.jpg,A large tow truck is pulling a red double decker city bus.
000000423632.jpg,A very dark lit picture of a view of a city at nighttime.
000000511218.jpg,a jet flying by in a bright blue sky 
000000430808.jpg,A green bus driving down a street next to a forest.
000000469921.jpg,A stoplight on a busy city street 
000000329148.jpg,A double decker bus on a city street followed by a single deck bus
000000089787.jpg,There are cars driving down a street in the city.
000000457948.jpg,A city bus driving on the street near some trees.
000000318107.jpg,A red double decker bus driving down a city street.
000000116740.jpg,Various traffic signals down a road in the city.
000000366994.jpg,A city street in England filled with double decker buses
000000468305.jpg,A bus driving down a city street next to a tall building.
000000263320.jpg,A bench over looks a rapid flowing river and forest.
000000342766.jpg,A group of boats floating on top of a lake.
000000493251.jpg,A blue and white jet airliner on runway next to mountains.
000000072600.jpg,A large jetliner flying through a cloudy blue sky.
000000254179.jpg,A city street filled with traffic and line with traffic lights.
000000286576.jpg,A double seat next to a door in a train.
000000019062.jpg,a red fire hydrant covered with some snow 
000000152341.jpg,A bench near grass and several different trees.
000000569375.jpg,Wildlife in open range grassy field on sunny day.
000000396188.jpg,A cop riding a motorcycle down a city street.
000000155388.jpg,The bench is at the top of the mountain.
000000119922.jpg,a white bench sand a fence and plants
000000021136.jpg,A view of a bus stand with a bus in it.
000000081654.jpg,a view of Big Ben from across the road.
000000211208.jpg,Thee city buses are parked in lanes in front of a large building.
000000345786.jpg,A deserted city street with a traffic signal at night.
000000448099.jpg,A pair of cyclists are riding across a city intersection.
000000261520.jpg,A view of a fenced off road with power lines in the back.
000000321577.jpg,A large jetliner flying under a cloudy blue sky.
000000479984.jpg,White double decker bus driving down the middle of a city. 
000000235473.jpg, a small hydrant sitting in the grass next to a tree
000000573981.jpg,a street view of a cars pedestrians a traffice light next to a building
000000515213.jpg,A nighttime view of traffic lights at slow shutter speed.
000000110634.jpg,a cloudy day on a street corner. 
000000352938.jpg,city buses are parked and traveling down the street
000000449029.jpg,Night time scene of city street intersection with vehicular traffic.
000000330708.jpg,A dove flying in the air with clouds.
000000479101.jpg,A large jetliner flying over a city at a low altitude.
000000471507.jpg,city street with traffic lights and white building
000000236267.jpg,A bus driving up a dirt road in the forest.
000000398139.jpg,a red fire hydrant covered in snow by a thin pole
000000132503.jpg,A close up view of a fire hydrant by the road.
000000276565.jpg,Roadway intersection with vehicle traffic and pedestrian in large city.
000000296059.jpg,A jetliner's wing flying over a large mountain range.
000000513447.jpg,A yellow double decker bus driving down a city street.
000000187280.jpg,A red double decker bus driving down a city street.
000000416816.jpg,A traffic light hanging over a street under a cloudy sky.
000000327448.jpg,THIS IS A PICTURE OF A LARGE CITY STREET
000000472293.jpg,City traffic on roadway near with mountains in background.
000000493806.jpg,A bus is traveling through a busy city area. 
000000176098.jpg,A red fire hydrant sits in the forest.
000000108876.jpg,A clock and benches on a city courtyard.
000000059167.jpg,A city street filled with lots of buses.
000000362662.jpg,A city bus drives towards a bus stop.
000000293074.jpg,A bright green bus goes down the streets in a city.
000000531657.jpg,snow surrounding a fire hydrant  and a car parked close
000000006414.jpg,Overview of a city with a busy bus stop in the foreground.
000000253323.jpg,A city bus is leaving the bus station.
000000540746.jpg,a straw hat sitting on a bench in a grass field
000000002639.jpg,a yellow bus and a blue bus drive next to each other in the city
000000533889.jpg,"A bus moves down an empty, city road."
000000034061.jpg,some rams laying in some long grass 
000000498769.jpg,A goat standing on top of a grass covered mountain.
000000175801.jpg,a red car driving down a city road on a cloudy day
000000546151.jpg,A yellow bus driving down a city street.
000000322975.jpg,A yellow fire hydrant sitting in the grass 
000000219274.jpg,a bus sitting parked on a wet road with some mountains off in the distance
000000271842.jpg,A fighter jet flying through a cloudy sky.
000000122973.jpg,A red trolley car driving down a city street.
000000297967.jpg,A city bus driving up a hill in a small town.
000000071796.jpg,A tree and some benches overlook the beach
000000197067.jpg,THIS IS A PHOTO IN THE FALL SEASON OF A FIRE HYDRANT
000000398373.jpg,Hind view of a park bench sitting in grass.
000000184642.jpg,A red fire hydrant in a grassy park.
000000117765.jpg,An aerial view of a shipping container yard. 
000000539848.jpg,City bus stopped at an intersection in front of a restaurant.
000000518553.jpg,A yellow and blue fire hydrant in the grass with bushes behind.
000000516012.jpg,A white metro bus with pink and purple trim drives down a city street in front of a glass building.
000000398177.jpg,A black fire hydrant sitting in the grass near a house. 
000000005684.jpg,A bus driving down a city street lined with buildings.
000000482505.jpg,Traffic lights blur on a city street in the setting sun.
000000571541.jpg,A lot of buses are parked in a grass field.
000000018661.jpg,A city street filled with traffic at night.
000000527083.jpg,A tall light house sitting next to the ocean.
000000004571.jpg,A wooden bench sitting next to a small forest.
000000100207.jpg,A bench sitting on top of a grass covered yard.
000000431696.jpg,An open field with a bench and a mountain.
000000066839.jpg,a public transit bus on a city street 
000000333083.jpg,A city bus rounding a corner on a city street.
000000429585.jpg,"An photo of a lake, fire hydrant, and sign."
000000320112.jpg,The image shows the trunk and back windshield of the car. 
000000496151.jpg,The boats are tied to the dock of the city river. 
000000449573.jpg,a bus drives down a city street 
000000315425.jpg,London double decker bus approaching a police car on city street.
000000230336.jpg,a fire hydrant on a street covered in snow near some trees 
000000473044.jpg,Rusted fire hydrant covered with bees in grass near road.
000000430298.jpg,A row of benches are in a grassy area with trees in the distance.
000000072041.jpg,Fire hydrant on a snow covered path during winter.
000000120645.jpg,"a bus coming down a mountain road, parking at a lookout point."
000000074100.jpg,A bus on a road with snow in a town.
000000242278.jpg,A tree sitting on top of a hill next to a body of water.
000000040008.jpg,The huge airliner is flying next to the clouds. 
000000308659.jpg,A thick blanket of snow covers a neighborhood.
000000135305.jpg,A fire hydrant is in the grass near rocks.
000000133883.jpg,A wooden bench is overlooking the mountain top.
000000249259.jpg,A grey fighter jet flying a cloudy weather.
000000193046.jpg,A bench sitting in the middle of a foggy forest.
000000249400.jpg,a bench sits on a sandy beach in front of some water 
000000392841.jpg,A weird whale shaped jet flying under a cloudy blue sky.
000000008686.jpg,There is a clock tower in the  city center 
000000380016.jpg,a wooden lawn chair sitting on a green grass patch next to a wooden structure
000000160585.jpg,A large ship in the ocean during the sunset.
000000443641.jpg,The view of a busy downtown city street.
000000359394.jpg,a blue and silver city bus traveling down a street
000000039978.jpg,Roadway intersection in city as seen at night with street lamps.
000000341736.jpg,The view out of a car window looking at a twilight city scene.
000000369905.jpg,A group of livestock that is climbing uphill through the grass.
000000522066.jpg,A city street with lots of cars and buildings.
000000022298.jpg,A city bus driving into a bus terminal
000000166499.jpg,The red city bus is driving next to a construction truck. 
000000399232.jpg,City intersection next to a high-rise brick building.
000000568050.jpg,The red double decker city bus is traveling in front of a car. 
000000044960.jpg,City street with double decker red buses moving at a rapid pace.
000000317460.jpg,Red double decker buses on a city roundabout.
000000077375.jpg,The skateboard is in the middle of the rows of seats.
000000320926.jpg,A large long bus on a city street.
000000352236.jpg,A close up view of a street traffic light.
000000143401.jpg,A red double decker bus is parked at a curb in the city
000000576464.jpg,A park bench overlooking a creek and mountain.
000000435224.jpg,a wood bench is looking out on a beach
000000315322.jpg,A double decker tour bus moving through a city
000000359030.jpg,The view down a busy city street taken from a car window.
000000430885.jpg,a green light silhouettes of buildings and a cloudy sky
000000499786.jpg,A fire hydrant spewing water on a snowy street
000000509217.jpg,a big city bus ride next to a park area 
000000425219.jpg,A raised fire hydrant is seen in a forested area.
000000143436.jpg,A bus stops at a small city bus stop/
000000382839.jpg,A bench sitting on a hill by some laundry on a clothes line.
000000098501.jpg,A traffic light leaning in the snow near a store.
000000473384.jpg,A London double-decker bus drives along a city street.
000000278357.jpg,black bench on the water front in a city
000000261670.jpg,An upclose view of water droplets on a bench.
000000347313.jpg,a city street with some cars driving down it 
000000498438.jpg,a number of cars on a city street with traffic lights 
000000009845.jpg,a close up ofa transit bus on a city street 
000000491397.jpg,There is a view of the skyline with clouds and buildings.
000000574476.jpg,There is a van driving on a road near a mountain.
000000161930.jpg,A ground view of a road next to a fire hydrant.
000000071440.jpg,Traffic signal on post at city roadway intersection.
000000182064.jpg,"There are bikes, buses, and cars on the city street."
000000065586.jpg,a city with cars and traffic lights made of lego
000000451101.jpg,A small family sitting on a bench on a grassy field surrounded by ducks.
000000244227.jpg,A view of a city intersection at night
000000493880.jpg,a fire hydrant in a field near city street 
000000263246.jpg,A bench is in the grass near the water.
000000048571.jpg,A red double decker bus driving past a forest.
000000367484.jpg,A city bus goes around a corner on an old street.
000000370235.jpg,The building of Capitol Hill is in the background
000000363885.jpg,A city street with lots of blurry traffic on top of it.
000000573485.jpg,A bus is next to a van on a city street.  
000000437522.jpg,Water from a broken hydrant flows into a city street.  
000000518575.jpg,Mountain goats grouped together in high grass in field.
000000233916.jpg,A city street filled with lots of traffic.
000000295762.jpg,A taxi driving down a city street below tall white buildings.
000000552330.jpg,A park bench with snow up to the bench.
000000108964.jpg,Rooftops with pink and blue clouds on the horizon.
000000056997.jpg,A pair of shoes sit underneath a row of seats.
000000412855.jpg,A long term exposure of a intersection in a city
000000101826.jpg,a red and black bus some grass cars and buildings
000000443179.jpg,A view of a park bench from above it.
000000409408.jpg,Bench sitting on sand surrounded by colorful flowers.
000000560581.jpg,A small bus is seen in a foreign city.
000000570032.jpg,A city bus is moving along a city street.
000000199119.jpg,A public transportation bus driving on a city road. 
000000569242.jpg,Red double-decker bus moving in between city streets. 
000000475451.jpg,a fire hydrant sits in some grass 
000000085397.jpg,A city street with tall buildings in the background. 
000000099025.jpg,A bus driving down the road near grass and trees.
000000262619.jpg,Bench near forest at edge of clearing area.
000000077055.jpg,A buy city street with several buses and taxis.
000000038053.jpg,A brown wooden bench sitting in the forest.
000000056132.jpg,a number of of cars on a city street 
