file_name,caption
000000016977.jpg,City street with parked cars and a bench.
000000459912.jpg,Rows of motor bikes and helmets in a city
000000005394.jpg,A car modified to drive in the water on a lake.
000000107960.jpg,"The view from a motorcyclist's point of view, looking down a street."
000000267802.jpg,Motorists and bicyclists in a busy city square.
000000059171.jpg,A beautiful blue and pink sky overlooking the beach.
000000126657.jpg,A group of motorcyclists are driving down the city street.
000000427091.jpg,City traffic and pedestrians are headed in multiple directions on the street.
000000263664.jpg,"A busy city street with a bus, taxi, and motorcycle."
000000507362.jpg,City street at night with several stop lights.
000000232223.jpg,A fighter jet flying through the sky with smoke coming off of it.
000000260409.jpg,A motorcyclist stands next to a motorcycle at a lookout over a beach.
000000385757.jpg,A picture taken from the driver seat of car at a stop sign.
000000425690.jpg,An overview picture of a street at night.
000000278237.jpg,a busy city street with cars and a bus
000000014297.jpg,A boat is docked and filled with bicycles next to a grassy area on a body of water.
000000271206.jpg,The front view of a sink with a mirror on top. 
000000370462.jpg,A ski lodge covered in snow next a mountain filled with trees.
000000306313.jpg,The front view of the stove built within the counter. 
000000123843.jpg,"The view of the shower, sink, and towel rack."
000000005879.jpg,Police officers riding bikes in the city at night.
000000272015.jpg,A park bench in front of a porch in a green grass filled park.
000000031519.jpg,a car over turned on a city street
000000008218.jpg,A large clock towers next to a forest filled with green trees.
000000264599.jpg,A street in a down town area of an asian city.
000000050411.jpg,A mounted police officer riding down a city street past parked cars.
000000120021.jpg,A motorcycle with a red seat is on top of a stand. 
000000236535.jpg,A small crop taking off in a grassy field.
000000246233.jpg,A massive wooden ship beached on snow covered ground.
000000170232.jpg,A bus driving down a street in a small city.
000000208169.jpg,Large number of motorcycles riding down a city street.
000000075560.jpg,Cross street intersection shot on a cloudy day.
000000469134.jpg,this is an image of several motorcyclists and walkers in the city.
000000506577.jpg,A green mountain bike sitting next to a bridge as a train passes by.
000000298784.jpg,Small fishing boat is sitting on a busy city street. 
000000122317.jpg,A large kite is being flown in a cloudy sky.
000000106335.jpg,a lot of cars in a city street with buildings in the back ground
000000070889.jpg,A jet on a runway with mountains in the distance.
000000278295.jpg,view of a mountain top and clouds from a very high angle
000000093791.jpg,Street signage is displayed on a patterned pole with architectural views around.
000000217039.jpg,Closeup of view of the cabin and wing of a large commercial airliner.
000000345930.jpg,"A view of a cloudy sky beyond a street lamp.
"
000000068852.jpg,A surfboard on top of a beaten car near the ocean
000000121430.jpg,A green motor bike with an odd leather seat sitting on a road.
000000515422.jpg,A cloud covered mountain sitting above a forest.
000000035897.jpg,A sloping street in a small mountain community.
000000498350.jpg,Motorcycle rider rides a rocky trail in the forest.
000000361386.jpg,A motorcycle parked in a parking lot with a helmet on the seat.
000000499802.jpg,A city street is lined with a parade of motorcycles.
000000013296.jpg,A clown on a bicycle on a busy street in a city.
000000025853.jpg,A mountain bike leaned up against a bus stop bench.
000000532285.jpg,A bike parked on a grass field next to a river.
000000490847.jpg,A mountain biker pumps his fist in celebration.
000000127119.jpg,A motorcycle is parked on a road by a beach.
000000263961.jpg,A bike leans on a wooden fence on a hill.
000000367336.jpg,an  image of an old town city with old cars
000000095736.jpg,A house's address is visible through a cracked windshield.
000000346904.jpg,A city bus driving over a bridge under an overpass
000000072810.jpg,A bicycle parked next to a snow covered park bench.
000000133503.jpg,A double decker bus driving while it snows.
000000093703.jpg,a white and blue jet is flying in some clouds
000000325958.jpg,A motorcyclist sitting by a sign with mountains across the way.
000000553588.jpg,An image of a sky scraper building in the city
000000356145.jpg,a motorcycle with a luggage holder in the back parked next to a waterfall
000000388026.jpg,Light poles in the snow with yellow traffic lights mounted on them.
000000436653.jpg,A small town street filled with traffic beneath a mountain.
000000493695.jpg,A city street filled with traffic at night.
000000296243.jpg,A white compact car parked on a sandy dirt road.
000000288923.jpg,A bicycle chained to a pole on a snowy day
000000262394.jpg,a motorcycle parked next to other motorcycles on city street
000000471488.jpg,"Motorcycle, automobile and pedestrian traffic on a city street."
000000556345.jpg,Cars coming into a city passing under a welcome sign.
000000285742.jpg,Black and white photograph of cars parked along a curb in the city
000000396204.jpg,Mountaineous view as seen from a jet airliner
000000111099.jpg,A city pier with benches to enjoy the view
000000348140.jpg,"A canoe that is in a lake during the day,"
000000462565.jpg,bike riders passing Burger King in city street
000000172911.jpg,A car seat covered in a piece of cake and frosting.
000000521877.jpg,A clock tower sits against a blue sky in a graveyard.
000000566249.jpg,a motorcycle parked in a city street with houses in the background
000000062443.jpg,A view form under a tree of a window
000000391371.jpg,a silver park bench sits in concrete with grass behind
000000315868.jpg,There is a custom painted motorcycle with a black seat
000000270376.jpg,A downtown area of a city with buildings and billboards. 
000000025972.jpg,A blue love seat sitting on a trailer attached to a bike.
000000438024.jpg,A city with a river in the middle with boats docked
000000213932.jpg,A black motorcycle parked on a city street.
000000556278.jpg,Bright lights flare over an empty city street.
000000567171.jpg,A city scene featuring an old-model car and a motorcycle.
000000004554.jpg,A group of snowboarders in the snowy conditions
000000315601.jpg,Straight ahead view of several lanes of traffic heading this way
000000191842.jpg,A view of a car with a TV in it.
000000095772.jpg,A pile of scrap metal sitting on the floor of a forest.
000000580829.jpg,A street scene of a road going through the mountains.
000000497504.jpg,I clock on a bridge that goes over a city street.
000000423767.jpg,A blue fighter jet on a runway surrounded by mountains.
000000266070.jpg,"Pink, yellow, and blue sky over a mountain range at night. "
000000326582.jpg,A fighter is jet flying through the clouds
000000320641.jpg,A biker rides past a calm lake on a bike trail. 
000000268259.jpg,A bike part is shown at a close view range.
000000507249.jpg,"A white and a black bicycle parked in a concrete bicycle parking station, next to a grass yard area."
000000029709.jpg,outdoor patio for guest seating at a restaurant
000000555648.jpg,A front view of a motorcycle in a parking lot. 
000000234697.jpg,Stop lights are lit up in a cloudy dark sky.
000000546687.jpg,Cityscape of a train stopping traffic on a street
000000562356.jpg,A group of motorcyclists traveling together on a cloudy day.
000000251124.jpg,A bike parked next to a street in a city at night.
000000579602.jpg,A crowded beach with giant kites flying over head.
000000303928.jpg,a walk in shower with a seat next to a white sink.
000000047873.jpg,a view of a counter top in a diner
000000103035.jpg,Some cops on motorcycles in a city parade.
000000235380.jpg,A street view of a city with several cars and buildings present
000000504498.jpg,"The rider, clothed in camoflague and ski boots, is sure to blend into the grassy area on his motorbike."
000000074743.jpg,A blue seat in the back of a bus with a painted above it.
000000503255.jpg,The bench at the tree offers a respite and a scenic autumnal view of a grand valley 
000000205102.jpg,Unoccupied bike resting on a barrier next to a snowy pathway.
000000205573.jpg,A motorcycle stopped on the road during nighttime in the city. 
000000455261.jpg,We are looking at the front of a motorcycle from the drivers point of view.
000000425280.jpg,A city bus traveling down a rod next to a stadium.
000000183407.jpg,A motorcycle parked on a grass covered field.
000000011182.jpg,"A city scape, the main brick building has a small clock tower on top. "
000000235491.jpg,A city street with a sign that says fun
000000327263.jpg,A park bench decorated with flowers sits by a grassy field.
000000268943.jpg,A lake filled with water and a kite flying over itl
000000094610.jpg,A classic image of a city with cars parked on the street. 
000000366111.jpg,Bicyclists dressed in vintage attire sit on a city street with modern cars.
000000212351.jpg,A jet flies across the center of a photo on a cloudy day.
000000392650.jpg,Blue sky with delta jumbo jet taking off
000000374987.jpg,A gang of bikers driving down a city street.
000000430690.jpg,A traffic light turns green on the corner of a city street.
000000239355.jpg,A police vehicle and a motorcycle on a city street.
000000510755.jpg,a line of parked motorcycles on some grass and trees
000000069926.jpg,A car driving down a busy city street at night.
000000406949.jpg,A large white bush driving down a city street.
000000129989.jpg,A fighter jet flying through a sky above water.
000000054039.jpg,Several motorcycles and cars parked on a city street.
000000144064.jpg,A plan sitting on top of a sandy beach.
000000359182.jpg,A LOT OF CITY COP BIKES ARE LINED UP 
000000128119.jpg,A CITY BUS IS ON THE STREET COMING THRU
000000232654.jpg,A messy baby eating in a baby seat
000000155270.jpg,A police officer rides a motorcycle next to a beach.
000000538230.jpg,A group of dirt-bikers racing on a grass course.
000000522554.jpg,A snow covered wood bench in a park
000000170550.jpg,A street sign in a construction area pointing to Royal ascot and Milnerton Ridge
000000237759.jpg,A large intersection of roads in a city.
000000068114.jpg,a city street with red stoplights and tall trees.
000000347535.jpg,A black and white photograph of a city street scene.
000000503837.jpg,Motor cycle and truck traffic in an oriental city
000000041397.jpg,There are benches on the grass under the tree.
000000134010.jpg,A view out of a train window as it goes down the tracks.
000000036478.jpg,A aerial view of a far away surface and a wing.
000000325768.jpg,A small kitten is lying on the seat of a large motorcycle.
000000106739.jpg,A baby is walking by a low stop sign in the city.
000000040446.jpg,A view from the back of a church.
000000298137.jpg,A jet airliner flying over a building with sky in background.
000000525208.jpg,A busy city street filled with traffic at night.
000000565031.jpg,A construction site as can be viewed from the street of a building.
000000404988.jpg,A line of benches that are snow covered
000000208991.jpg,A car with its doors open on a street in the city with motorcycles parked on it. 
000000069670.jpg,An old motorcycle standing in a grassy field.
000000071384.jpg,an over head view of cars parked below
000000153083.jpg,A group of motorbikes are parked in a forest.
000000322922.jpg,"The bicyclists have formed a train, and are being towed by the city bus."
000000170852.jpg,There is a surfer riding a wave in the ocean
000000385346.jpg,a public transit bus on a city street
000000542509.jpg,A full view of a working office with computers. 
000000560623.jpg,The view of runway from behind the windows of airport.
000000159427.jpg,A jet high in the sky above a city intersection.
000000152111.jpg,A surfer wind surfing on the ocean with clear skies.
000000347367.jpg,Jet engine shown in front of snow covered mountain.
000000015663.jpg,Bicyclists riding down the middle of a city street.
000000051495.jpg,The view of the tail of a jet while it flies over a city.
000000076674.jpg,A wooden bench with grass and a beach behind it.
000000323418.jpg,Eight jets in the sky in a flying formation.
000000408621.jpg,"Metro bus driving past the Green Lake Branch of Seattle, WA library."
000000509185.jpg,An upward view of a white building with a clock on the front.
000000554466.jpg,A church in the distance on a snow covered rise.
000000394773.jpg,A parked blue and white motorcycle with a black seat.
000000548464.jpg,A street sign and traffic lights next to it on a city street.
000000446455.jpg,The mountains can be seen behind the Chevron sign. 
000000371588.jpg,Yellow military jet making pass against gray cloudy sky.
000000490225.jpg,Refueling truck near commercial airliner on tarmac on cloudy day.
000000421682.jpg,The moon in the sky above a jetliner.
000000557552.jpg,A picture showing a long line of scooters parked on a city street.
000000520956.jpg,A brown city building with a large clock.
000000213687.jpg,Motorcycles driving down a wide city street nearing a white building.
000000264909.jpg,A black and white photo of tow rams on a rocky hill.
000000075857.jpg,A church filled with rows of wooden seats.
000000137369.jpg,A silver motorcycle parked next to a forest filled with lots of trees.
000000308507.jpg,A full view of a picture of some scary looking items. 
000000359086.jpg,a motorcycle parked in the grass by a factory
000000388677.jpg,A police office riding a police bike in a city area.
000000233090.jpg,A boat floating in a harbor of a very large city.
000000480225.jpg,A crowded city street filled with traffic at night.
000000259342.jpg,The building in the city has a lot of signs on it. 
000000507143.jpg,"The view of the headlights, handlebars and mirror of a motorcycle"
000000425303.jpg,A cloudy sky looms over a dock and the water.
000000212122.jpg,A boat out in the clear ocean where you can see the bottom.
000000242529.jpg,Bicycle parked on grassy area near waterway on clear day.
000000031446.jpg,A squadron of fighter jets flying through a cloudy blue sky.
000000388619.jpg,A group of bikes are on the beach with a boat nearby on the water.
000000135275.jpg,A small blue car on a city road.
000000574790.jpg,A busy city street with lots of traffic lights.
000000403820.jpg,An aircraft is flying high in the blue cloudy sky.
000000388643.jpg,A jet engine flying over a cloud filled sky.
000000277865.jpg,a bathtub with a scenic view of the water and boat
000000220106.jpg,a motorcycle parked on a city street with other motorcycles
000000192594.jpg,A view of an empty city street at night
000000043678.jpg,The white flight flying in the sky and it about to land
000000577398.jpg,A motorcycle rider rides by the blue mountains.
000000369820.jpg,"A view of an old automobile, flower bush and a yellow fire hydrant. "
000000124102.jpg,Century old buildings stand near streets in a city.
000000111830.jpg,a jet is flying across a very cloudy sky
000000283380.jpg,A new black and yellow motorcycle on the sea beach.
000000110081.jpg,a group of motorcyclists riding with traffic in the city
000000064240.jpg,Four identical motorcyclists viewed from the back as they look over their shoulders.
000000157944.jpg,A reality TV star being interviewed on a show.
000000060093.jpg,A street with a traffic light under a cloudy sky.
000000093736.jpg,Bikes are sitting against seats in a train car.
000000577355.jpg,A streetlight in front of a cloudy storm.
000000038465.jpg,Traffic on a busy city street at night.
000000474526.jpg,a truck driving on a city street with a traffic light
000000500420.jpg,A multicolored kite against a blue sky with clouds.
000000279140.jpg,A city bus traveling on a road near a street sign.
000000242222.jpg,a red motorcycle parked on some gravel next to grass 
000000193424.jpg,A view of a traffic street filled with cars and motorcycles. 
000000309492.jpg,A police officer driving a motorcycle down a city street.
000000123289.jpg,A crowded city street filled with traffic at night.
000000142257.jpg,Multiple vehicles on a city street near a light.
000000262800.jpg,Jet flying in the sky among the clouds.
000000023369.jpg,A motorcycle parked near a grassy area with a flag in the background
000000050942.jpg,"A closeup view of a desk with a keyboard, mouse, and monitor."
000000377401.jpg,The tower of a building near a park with snow on the ground.
000000010039.jpg,An antique clock tower rises above into the cloudy skies.
000000042433.jpg,The motorcycle riders have gathered in the mountains.
000000457684.jpg,A small Sky west jet liner on the tarmac
000000352361.jpg,A snowboarder performing a jump off of a hill.
000000267875.jpg,The view from a cars windshield of a cit street with a red light.
000000266348.jpg,A sky scrapper standing tall on a sunny day.
000000462341.jpg,A large clock tower towering over a small city.
000000388290.jpg,there is a close up view of several benches
000000171962.jpg,A city bus driving down a road with bikes fixed to it's front.
000000009274.jpg,a clock on a pole next to a city street
000000072843.jpg,A vibrant UK city with red double decker buses riding along the street.
000000241350.jpg,A fish eye view of a bicycle and a wooden desk
000000569103.jpg,A closeup view of a baked blueberry cake or dessert.
000000392364.jpg,a city square at night with buildings around it
000000050481.jpg,A statue near a traffic filled city street. 
000000328041.jpg,a traffic light and street signs on a city street
000000232949.jpg,A small cream colored van driving down a small city street.
000000116279.jpg,A large jetliner flying through a cloudy blue sky.
000000102637.jpg,A large jetliner flying over the ocean and mountains.
000000519676.jpg,There is a fine motorbike with fur covering on the seat in the parking lot.
000000270918.jpg,A long exposure photo of an old city building.
000000358883.jpg,Bathtub has a great view of the city from the odd shaped window
000000400658.jpg,A view of a narrow city street during non-business hours.
000000186368.jpg,A lady smiles while skiing at a snowy ski resort.
000000330455.jpg,"It is night time, and the city's  traffic lights are controlling the flow of traffic."
000000365556.jpg,A window of the view of the clouds in the sky .
000000173379.jpg,Four apples sitting in a bowl viewed from above.
000000480951.jpg,Car headlights and brake lights in X form with night view
000000532671.jpg,A blue motorcycle parked on street next to hill.
000000308907.jpg,An old city building is by a pink sky.
000000572604.jpg,Red brick building with fire hydrant and car with cloudy sky
000000232905.jpg,a clock on a tower wit ha sky background
000000480605.jpg,A white jet airliner with blue sky in background.
000000353409.jpg,A group of motorcycles on a street next to grassy area.
000000404718.jpg,Motorcyclists riding down the street in a city.
000000083045.jpg,A bicycle parked next to an old boat on a pebbly beach
000000304044.jpg,A bus traveling down a city street at night.
000000201555.jpg,A sandy road construction site by a main thoroughfare
000000254571.jpg,The motorbike travels the dirt road with a beautiful view.
000000332877.jpg,A tree-lined city street with car and motorcycle traffic. 
000000468953.jpg,A policy officer talking to a fellow officer next to a busy city street.
000000440575.jpg,The snow covered mountain looks over the small city.
000000030685.jpg,Motor vehicles on roadway in urban city setting.
000000578962.jpg,A busy city street filled with cars at night
000000371151.jpg,View of a fireplace with picture hanging above and clock on top
000000157021.jpg,A large jet flying through a gray sky with four engines.
000000534736.jpg,A city street with lots of bicyclist and pedestrians. 
000000470423.jpg,There white motorcycles on grassy area next to trees.
000000201496.jpg,Pedestrians walk across a busy city street on a crosswalk.
000000367452.jpg,A tall clock tower is shown with a clear blue sky is in the backgroujf.
000000336695.jpg,View from the front of a motorcycle on a road. 
000000159537.jpg,A very tall clock tower towering over a city.
000000156098.jpg,"A late night, long-exposure picture of a city street."
000000398119.jpg,The city buses are stuck in traffic on the main road. 
000000182423.jpg,A sign on a busy city street pole
000000507927.jpg,Motor cycle riders in the city on a sunny day
000000566278.jpg,a motorcycle parked on a city street near a building
000000521995.jpg,A laptop computer is on a city desk.
000000184789.jpg,A large jet liner flying through a cloudy sky.
000000359277.jpg,Large group of motorcycles parked next to each other in a city. 
000000300066.jpg,A plan stands on the tarmac in the shadow of a mountain.
000000102906.jpg,There are no cars on the long city street.
000000471097.jpg,White car parked at curb with parking meter in city setting.
000000117725.jpg,A view of a church's roof top between some trees.
000000056212.jpg,The bowl of a white porcelain bidet with the seat raised.
000000560440.jpg,"A view of a crosswalk that leads into a intersection. 
"
000000188891.jpg,A city skyline is shown with clouds in the sky.
000000242679.jpg,"A seat under a mirror onboard a train, next to a cluttered counter."
000000536782.jpg,A snowboarder is hopping over a small snow hump.
000000046736.jpg,A surfer is riding a large wave in the ocean.
000000278760.jpg,a jet flying high in the sky and a building and windows
000000235663.jpg,an aerial photo of the jets wing and snowy mountains
000000553747.jpg,A close up view of a refrigerator door with a plaque and pictures on it.
000000480752.jpg,there is a bench on a very high hill or mountain
000000152176.jpg,A bike is parked on the grass in front of the lake. 
000000430519.jpg,a public transit bus on a city street
000000192817.jpg,A view from a window high up in the sky.
000000299970.jpg,A car and a sign on a city street.
000000457683.jpg,The motorcycle has a large cargo box attached to the seat.
000000291537.jpg,there is a snowboarder riding down a hill or mountain
000000169936.jpg,A view of a mountain top from a window in a high flying aircraft. 
000000168580.jpg,Motorcycle police officer riding through the city  
000000465424.jpg,Street view of a group of bikers and their motorcycles.
000000356394.jpg,bicycles riding in a crowded downtown city street
000000328316.jpg,A picture of a street on a busy city street.
000000106470.jpg,A crowded beach scene with families playing and a kite flying
000000573962.jpg,A look through a window at a very busy city street.
000000452700.jpg,A busy city street with several double decker buses in traffic 
000000110501.jpg,Clocks on a light pole on a city street.
000000436174.jpg,a row of motorcycles in front of a forest
000000271266.jpg,A large jetliner flying through a blue cloudy sky.
000000511583.jpg,A gray Ford Crown Victoria parked on a city street at night.
000000023879.jpg,A train traveling down train tracks near a city.
000000122302.jpg,A crowded city street with a row of bicycles 
000000515565.jpg,View of an architectural steeple from down below.
000000258674.jpg,a parking meter on a city street leaning
000000528069.jpg,A distant view from high up in the sky in a window.
000000058254.jpg,This is a point of view shot from a TV remote with a TV in view in the background.
000000370596.jpg,A  street view of a bunch of bikes and an old moped.
000000257407.jpg,A nighttime view of a building with the lights blurred.
000000012238.jpg,Some cars are traveling on the streets on a cloudy day. 
000000242673.jpg,a long pile up of cars lined through the city and around the buildings
000000041128.jpg,A parade on a street with several officers on motorcycles riding while confetti falls from the sky on them.
000000259049.jpg,a public transit bus on a city street
000000091617.jpg,An office in a high rise building overlooking the city.
000000283495.jpg,A large jetliner flying under a cloud filled sky.
000000091236.jpg,Jets are flying in formation across the sky on a clear day.
000000075095.jpg,A park bench with ice and snow under it.
000000071239.jpg,A motorcycle sits in a graveled area with a steep hill in the background.
000000478858.jpg,A bicycle chained to a pole in the city 
000000410855.jpg,The traffic on this street in the city is backed up. 
000000163585.jpg,The frame of a bench is metal and the seat of the bench is wood.
000000192529.jpg,a bus bench sits next to a city street
000000133195.jpg,a very tall building with a city clock on it
000000028675.jpg,It's a cloudy night for a ride on the motorcycle.
000000375440.jpg,A number of benches at the beach and a boat in the sea
000000354533.jpg,A motorcycle parked on top of a sandy beach.
000000089999.jpg,A car and bike on a city street.
000000116255.jpg,A large jet flying through a sky under clouds.
000000175570.jpg,A bus in the city making a left turn.
000000281317.jpg,City street at night with bright lights shining.
000000321886.jpg,"Motorcycle, bicycle and bus traffic in an oriental city"
000000175331.jpg,"A view of a top of a building in day, it appears to be old."
000000512421.jpg,A large jet flying next to the sun in a cloudy sky.
000000275441.jpg,"A bicycle with baskets front and back, leaning on a railing on a city street. "
000000544365.jpg,A view of a TV with a few guitars next to it.
000000245450.jpg,A full view of a train in a subway station.
000000011887.jpg,A full view of some cars and motorcycles parked on a lot. 
000000465418.jpg,A bus on the city street close to a bus stop
000000037181.jpg,A silver motorcycle parked near a city road as a car passes behind it.
000000308276.jpg,A motorcycle parked on a city street in front of a bookstore.
000000580041.jpg,A city street filled with traffic and parking lights.
000000032284.jpg,A motorcycle parked in the grass near a trailer and a truck. 
