file_name,caption
000000041212.jpg,A soccer player winds up for a mighty kick.
000000539386.jpg,A wind surfer posing for a photo while riding in the open.
000000518127.jpg,A view of a field with giant plastic balls on it.
000000318063.jpg,This an above angle view of a surfer riding a wave.
000000245067.jpg,A surfer is riding a wave in the ocean.
000000438807.jpg,A surfer riding a wave on the ocean.
000000389404.jpg,A rooster in the grass biting on a carrot. 
000000473973.jpg,a surfer is riding the waves in the ocean
000000132987.jpg,Surfers with paddles riding waves in open ocean.
000000023754.jpg,Surfer performing aerial trick over breaking ocean wave.
000000303342.jpg,A snowboarder is going down a snowy hill.
000000290602.jpg,A snow boarder making a big jump on a slope
000000133596.jpg,A few friends having fun playing soccer on the beach.
000000256903.jpg,A time lapse image of a snow boarder going over a ramp.
000000168093.jpg,A surfer hanging 10 on the ocean waves.
000000361860.jpg,The snowboarder is jumping through the snow on a yellow board.
000000342958.jpg,A yellow surf board sits on a balcony overlooking the ocean. 
000000322816.jpg,A cake decorated to look like a sandy beach and the ocean with a toy surfing and toy palm trees on a table. 
000000391463.jpg,a surfer walks on a beach in the sand and fog
000000142934.jpg,Snowboarders walk up the mountain with their boards on their backs.
000000378967.jpg,A surfer coming in to the beach on a small wave
000000266278.jpg,Some surfers are about to go surfing in the ocean. 
000000050099.jpg,A full view of a computer with a screen on the wall. 
000000141779.jpg,A group of surfers are hanging out around a picnic table on the beach. 
000000523955.jpg,A snowboarder is making his way down the snowy hill.
000000448787.jpg,There is a surfer riding a wave at this beach.
000000485129.jpg,A surfer is riding on a wave in the ocean.
000000291941.jpg,There is a television set which has been dumped on a beach with seaweed. 
000000281377.jpg,A surfer in a wetsuit going out to sea.
000000232625.jpg,Snow boarder riding during the night over a fence.
000000576463.jpg,A Chelsea football player runs for the ball
000000214124.jpg,a close up view of a pie with strussel toppings
000000244823.jpg,An old tv lies broken on a beautiful beach.
000000015303.jpg,A surfer wiping out on a wave in the ocean 
000000465130.jpg,A wide angle view of this hotel suite
000000249246.jpg,Surfers and swimmers are playing in the ocean.
000000091373.jpg,a group of peopl standing arond on the beach wearing wetsuits 
000000045809.jpg,A group of surfers ride a wave in the ocean.
000000154798.jpg,Four surfboarders are carrying their boards on the beach.
000000486803.jpg,A snowboarder hitting a trick on a jump in the middle of a mountain chain.
000000306536.jpg,A full view of a wooden table along with books. 
000000151589.jpg,A blue snowboard sitting on top of a snow covered slope.
000000099348.jpg,a crowd of surfers are all on a beach
000000361587.jpg,A surfer rides a large wave in the ocean.
000000503332.jpg,A surfer rides the top of a wave in the ocean.
000000321258.jpg,A surfer cuts through a small wave in the ocean.
000000119226.jpg,A surfer wearing a wetsuit running down the beach with his board
000000573395.jpg,a group of surfers are riding waves in the ocean
000000243968.jpg,A snowboarder gets air as they go over a snow ramp.
000000460632.jpg,a surfer riding on a small wave in the ocean
000000486834.jpg,Surfers are holding their boards in the sand after coming out of the ocean.
000000222788.jpg,Happy surfers holding up their boards on the beach
000000019559.jpg,A close up view of a small rack with some tooth brushes.
000000476349.jpg,A snowboarder is sitting on a snowy slope
000000530558.jpg,Surfer riding on wave in middle of ocean preparing to jump
000000259335.jpg,Surfers in silhouette on a beach walking toward the water.
000000365851.jpg,A surfer runs along the beach with a white board.
000000069965.jpg,a surfer riding the wave at the beach
000000333150.jpg,Laptop computer on table at indoor event with audience seated.
000000045627.jpg,An athlete is performing on a surfboard on a lake.
000000149155.jpg,Several surfers out in the ocean waiting for waves. 
000000491215.jpg,The snow boarder is near the top of the ramp.
000000332968.jpg,A view of a bunch of birthday cakes through the window.
000000401897.jpg,a surfer runs into the waves on a beaching with his surfboard
000000543082.jpg,A sailboarder holds on to the sail in the ocean.
000000192091.jpg,A surfer stands out in the shallow ocean waters.
000000145750.jpg,A surfer is riding a big wave in the ocean. 
000000198043.jpg,A skateboard on top of a surfboard on a beach.
000000439427.jpg,a snow boarder ramping  a small snow mound
000000161635.jpg,Surfboarders are riding waves in the ocean together
000000105879.jpg,"As the sun sets, the surf boarder heads for the beach."
000000365711.jpg,A surfer with sunscreen on his face stands on the beach.
000000028290.jpg,A group of surfers change their clothes on a beach.
000000485155.jpg,A snowboarder in a red jacket is about to go downhill.
000000343038.jpg,A snowboarder kneels over in the snow to pose for the camera.
000000562557.jpg,Four surfers stand on the beach watching the water.
000000402711.jpg,A surfer is on a beach and is holding a surfboard. 
000000462805.jpg,A pair of snow skis and a snowboard in the snow.
000000114375.jpg,Several windsurfers are riding the waves in the ocean.
000000221725.jpg,something is half way buried in a sandy field
000000579294.jpg,"The snowboarder is enjoying going down the hill.
"
000000022498.jpg,a sail boarder in a wet suit water trees and clouds
000000502896.jpg,A snowboarder boards down a hill with a lot of snow
000000088817.jpg,Several wind surfers are on the blue water.
000000117127.jpg,A surfer walks along the beach at sunrise.
000000476864.jpg,A surfer rides a wave in the ocean.
000000410195.jpg,A surfer with a blue surfboard on a big beach.
000000208543.jpg,A skiier in mid-air going down a hill.
000000191360.jpg,Several yellow surf boards are lined up on the beach. 
000000578752.jpg,The beachfront has tracks of footprints and a figure which appears to be  cross.
000000375285.jpg,The beachgoers are curious about what is in the water.
000000526133.jpg,a snow board sits on some snow 
000000031281.jpg,A surfer carries his surfboard beneath a tall cliff
000000518968.jpg,Surfer riding breaking wave at ocean with other surfers nearby.
000000020179.jpg,A tattooed surfer walking on the beach with his board
000000000360.jpg,The snowboarder has jumped high into the air from a snow ramp.
000000383420.jpg,A view of a  remote with a popcorn hour book on the table.
000000160185.jpg,A professional soccer player dribbling a ball on a grass surface.
000000274792.jpg,A view of a cake tray with residue on the bottom.
000000208342.jpg,A snowboarder kicking up a cloud of snow as he does a flip.
000000490244.jpg,a bunch of surfboards are piled up by a hill
000000344013.jpg,A tennis player winds up a backhand shot
000000023294.jpg,Four surfers holding their surfboards at a beach
000000256031.jpg,A surfer is surfing the waves in the ocean. 
000000003837.jpg,Surfers are practicing in the shore of a beach.
000000110877.jpg,Surfers paddling back to shore area from open ocean.
000000122861.jpg,Surfers braves the waves on the choppy blue ocean.
000000578788.jpg,A skateboard rider on top of a handrail by a path in the city
000000541917.jpg,a snow board leaning against a wall near a chair 
000000413811.jpg,A crowd of surfers and swimmers enjoy a day at the beach.
000000456077.jpg,A surfing simulator with actual water in the city. 
000000006028.jpg,A group of surfers in wetsuits amid ocean waves.
000000542938.jpg,A surfer ending his surf as he reaches the beach.
000000527002.jpg,A parasailer is gliding through the ocean holding the bars.
000000268987.jpg,surfer jumping into ocean with their surfboard - wooden pier in the foreground
000000220871.jpg,A surfer in a black wet suit and a blue surfboard is standing on the beach.
000000355297.jpg,A surfer in the middle of a jump in the ocean
000000000836.jpg,A snowboarder does a flip after jumping off a hill.
000000272718.jpg,there is a wakeboarder that is riding in the ocean
000000489313.jpg,A snow boarder in mid trick with the Hilton in the background
000000379488.jpg,A surfer surfing the pipeline in the ocean
000000074349.jpg,A snow boarder performs a jump on a ski slope.
000000465986.jpg,A snowboarder standing in the snow next to a fence.
000000240275.jpg,A surfer rides a wave in the ocean.
000000406917.jpg,this lady is walking along the shore on a beach
000000224991.jpg,A surfer is wind surfing on some choppy waves.
000000315991.jpg,Several surfers are riding the blue ocean waves.
000000283659.jpg,The parasailer is enjoying the big waves at the ocean..
000000431058.jpg,A snowboarder is shown against a beautiful sky and trees.
000000231037.jpg,there is a surfer that is riding a wave in the ocean
000000252659.jpg,Doubles tennis match on a real grass court
000000550365.jpg,A snowboarder is flying through the air doing stunts on his snow board.
000000217323.jpg,a snowboarding moving down a hill laughing 
000000152530.jpg,A surfer rides a wave in the ocean on his surfboard. 
000000196660.jpg,"A surfer, surfboard under his arm, near a no swimming sign on a beach."
000000121961.jpg,A surfer riding their surfboard through waves in the ocean.
000000520147.jpg,A snow boarder is on top of a sign with his board and has his hands out for balance.
000000115924.jpg,A surfer jumps on top of a wave in the ocean.
000000512455.jpg,The snowboarder wearing a helmet is jumping over a hill. 
000000170181.jpg,A group of snow boarders on a snowy white hill
000000365687.jpg,A surf boarder rides his board in the ocean.
000000510791.jpg,A tennis player walking on a grass court.
000000478433.jpg,A surfer surfing a wave next to a fishing dock in the ocean.
000000483159.jpg,A close up view of some very pretty pastries.
000000145325.jpg, an office chair with a pillow on the seat
000000380495.jpg,Surfboards laying on an empty beach by the ocean.
000000147132.jpg,A pair of surfers pause on a populated beach.
000000310196.jpg,A snowboarder is sliding down a snowy slope.
000000477671.jpg,A sign for a snow team hangs in the window
000000348524.jpg,Snowboarders sit on a mountain slope in the snow.
000000146272.jpg,A snowboarder sits in the snow at the top of a mountain.
000000190095.jpg,A surfer is surfing in the ocean among the tallest waves.
000000533628.jpg,a surfer riding a beautiful green ocean wave
000000217205.jpg,There are surfers under a dock near the ocean.
000000044536.jpg,The surfer paddles far out into the ocean.
000000131152.jpg,A surfer riding a wave onto the beach with multiple surfers behind him.
000000465588.jpg,A surfer hitting a wave in the middle of the ocean.
000000503424.jpg,Vibrant cake displays in a glass case to view.
000000312078.jpg,A surfer that is riding a really big wave in the ocean.
000000452687.jpg,A close up of a boot on a snow board in the snow
000000378962.jpg,An outdoor product stand on a pedestrian street in the city
000000262274.jpg,A lifeguard's surf board on the beach near the surf.
000000274651.jpg,A delicious philly cheese steak on a big roll
000000265464.jpg,Surfers in wetsuits ride on the waves in the ocean.
000000513189.jpg,Surfer riding a larger wave on the ocean as it starts to break.
000000176381.jpg,A surfer riding on top of the waves at the ocean. 
000000362409.jpg,Surfer riding on decent sized wave as it breaks in ocean.
000000453310.jpg,a red city work truck with red emergency lights on the top
000000434177.jpg,A surferboard group stand sont he beach in the water
000000459923.jpg,Surfer any black wetsuit holding their board in front of the ocean. 
000000237463.jpg,A surfer putting his surfboard down on the beach.
000000281508.jpg,A bunch of surf boards lined up along a fence at a beach.
000000112751.jpg,To surfers holding boards underneath their arms going into the ocean. 
000000066238.jpg,A snow boarder does a trick in the middle of the air.
000000137682.jpg,A surfer in a wetsuit skimming a wave in a calm ocean
000000533227.jpg,Several surfers are in the ocean with their boards.
000000434510.jpg,A surfer riding a wave in the ocean.
000000173229.jpg,A surfer is standing in his wetsuit on a hill.
000000229529.jpg,A surfer riding a surfboard through cresting ocean waves.
000000184172.jpg,A wake boarder gliding through the waves of the ocean
000000527718.jpg,A snowboarder sits on the snow near a net.
000000367626.jpg,Surfer on an ocean wave with an unusual object.
000000268992.jpg,A small triangle chair with a string seat next to a laptop.
000000361171.jpg,An athlete with a snow board is performing on a city street.
000000173138.jpg,a ocean that has a surfer in it
000000036032.jpg,a snowboarder jumps off of a hill instead of just sliding down it
000000298344.jpg,A boogie board or writing on a large wave in the ocean that is Brakey
000000083408.jpg,Surfer riding large breaking wave near beach at ocean.
000000132509.jpg,A surfer is walking on the beach on a cloudy day.
000000455279.jpg,Kneeling snowboarder smiles on snowy slope with mountain in the background
000000315810.jpg,A tennis player winds up for a mighty serve.
000000145542.jpg,A surfer rides a wave in the ocean.
000000185487.jpg,A snowboarder holding a wind sail lifts from the ground.
000000298586.jpg,A snowboarder doing a trick down a snowy street
000000476722.jpg,a time lapse image of a snowboarder jumping off a ramp onto a snowy mountain
000000487861.jpg,The information center for a snow boarding park.
000000407948.jpg,some body boarders water sun sand and clouds
000000316995.jpg,A life guard walking with his surf board on the beach.
000000205251.jpg,Several surf boarders at a city wave pool.
000000070896.jpg,3 surf boarders enjoying themselves in the ocean.
000000068257.jpg,This is a picture of a fearless wind surfer
000000351793.jpg,This is a downhill snowboarder lifting the front edge of his board up to expose his green and yellow board to the camera.
000000299254.jpg,"A snowboarder, with a yellow snowboard, poses in front snowy mountains."
000000035711.jpg,A cloudy day for a swim at the beach.
000000201498.jpg,A view of a snowboarder as they crash into the snowy ground.
000000526040.jpg,He was almost sitting in the snow as he came down the run on his snowboard.
000000007899.jpg,A baby sitting in the grass watching kites fly in the sky.
000000533537.jpg,A clocktower saying it is 12 pm in the city.
000000264730.jpg,A clock on display on a wall in the city.
000000204324.jpg,A family flying a kite at the beach.
000000397994.jpg,Parachutes fly through the sky above the ocean. 
000000370123.jpg,An old clock tower rises into the sky at night.
000000202923.jpg,A view from behind a mesh fence of a baseball game.
000000129159.jpg,A clock tower as viewed from a railway station
000000170914.jpg,"On a beach, there is a clock in the middle of the sand."
000000274438.jpg,"Kite flying in the breeze on the beach.
"
000000337420.jpg,Windsurfer kites are seen from above the beach.
000000118034.jpg,A hand holding a camera with a small viewfinder screen.
000000388854.jpg,Big Ben towering over the city of London under a cloudy sky.
000000317763.jpg,A view of a close up of a computer.
000000396676.jpg,An intersection of a city with pedestrians in the crosswalk.
000000563731.jpg,A clock attached to an old city building.
000000393277.jpg,A clock statue surrounded by city traffic and streets.
000000074412.jpg,Cars parked on a beach at the ocean.
000000046603.jpg,A tall building with a clocktowner and sky in the background.
000000333348.jpg,A night snowy view shows a clock tower lit up.
000000540636.jpg,Kites are flying in the wind with bikers below them.
000000206757.jpg,City street shopping area with pedestrians walking about.
000000460837.jpg,A lady on a sandy beach flying a kite.
000000401240.jpg,The front entrance view of a station building. 
000000568101.jpg,kites being flown on the beach near the ocean
000000475890.jpg,An old clock telling the time on a city street.
000000211713.jpg,A view of a baseball game being played on a field in a stadium.
000000202777.jpg,A building with a gold steeple under a cloudy sky
000000144935.jpg,A beach gets crowded on a sunny day.
000000098443.jpg,There is big Ben in the middle of the city.  
000000532833.jpg,A large free standing street clock with a cloudy sky.
000000236324.jpg,A tower clock on the building in the city
000000054533.jpg,A lap top computer seated on the table
000000561412.jpg,A clock tower is featured against a cloudy blue sky.
000000300989.jpg,A big Ben on top of a building in the city.  
000000509551.jpg,An old clock tower captured on a partly cloudy day 
000000064150.jpg,clowe up of a large clock with a sky background
000000247945.jpg,An ornate building is viewed by a crowd.
000000381504.jpg,Seating and depot for mass transit ticket sales.  
000000044352.jpg,An aqua colored clock is attached to a city building.
000000021919.jpg,A helmeted rider is lifted off of the ground in a grassy area.
000000186013.jpg,Kites being flown at the beach at twilight.
000000205239.jpg,A clock tower surrounded by blowing snow in a city.
000000253413.jpg,A bridge over a lake runs through several large buildings.
000000243946.jpg,A crowded beach is crowded with kites in the sky.
000000314607.jpg,A tower clock on top of the building in the city
000000212801.jpg,Several small arc shaped kites flying above an ocean
000000264686.jpg,Here is a sadly decorated loft in the city.
000000440514.jpg,A city street is busy with traffic during the day.
000000408532.jpg,landscape of a parking lot and a building that has a clock on the roof
000000487013.jpg,A black post with a clock on it in a city.
000000366759.jpg,A picture of a tower clock in the middle of the city on top of a building 
000000018073.jpg,A kite flying over a wave filled ocean under a cloudy sky
000000233862.jpg,There are four kites flying on the beach. 
000000509388.jpg,Big Ben clock tower towering over the city of London.
000000003865.jpg,A para sailer approaching the beach on  a sunny day
000000231281.jpg,A baseball game is being played on a dirt and grass field.
000000306914.jpg,A scene of octopus kites in multiple colors flown over a grassy hill.
000000518234.jpg,A leafless tree with the view of a clock tower in the distance
000000256095.jpg,The huge structure has a bridge nearby on a cloudy day.
000000313990.jpg,a large tower with a clock with a sky backlground
000000000873.jpg,"Chimneys point to the sky on a clear, sunny day."
000000115772.jpg,Television view of a baseball player holding a bat. 
000000542792.jpg,A giant baseball bat leans against a city building
000000109653.jpg,a kite flying high in a partially cloudy sky
000000050232.jpg,A view of an architectural building topped with a clock tower.
000000035760.jpg,A large clock tower towering over a city.
000000280007.jpg,Clock tower with USA flag and partly cloudy sky background.
000000022382.jpg,A clock tower is in the middle of the city with clocks
000000440443.jpg,A CITY CLOCK WITH A TOWER IN THE FRONT OF A BUILDNG
000000005758.jpg,A clock tower rises into the sky as it displays the time.
000000291458.jpg,A clock tower gives the time in a city square.
000000208585.jpg,A brick bridge over a busy city streets.
000000385236.jpg,A quaint city block full of tudor style buildings and a clock tower.
000000331282.jpg,A large clock tower attached to a church next to a rocky mountain.
000000441874.jpg,A view of a baseball game on a baseball field.
000000402674.jpg,View of a tennis net in front of a player holding a tennis racquet.
000000551907.jpg,A group of pedestrians walk down a city street next to a floating kite sign.
000000097146.jpg,A city street with old and new buildings in the distance.
000000169700.jpg,a tall clock tower with a sky in the abckground
000000485773.jpg,A large tower set against the night sky with a clock on it
000000228504.jpg,Flying a kite at the wide open spaces of the beach.
000000149398.jpg,a building with a tower on th top with a sky in the background
000000321805.jpg,a tower with a clock on top with a sky background 
000000162887.jpg,A hand holding a bunch of different types of clock sand watches.
000000525619.jpg,A grassy field with a kite in the sky in the background.
000000233848.jpg,It's a chilly morning here in the village. 
000000220137.jpg,"A tropically designed patio features a straw thatched gazebo,lots of grassy plants, and some dramatically designed blue bases for visual interest."
000000524577.jpg,A city block with a building and a clock
000000277046.jpg,a clock on top of a tall building with a sky in the background
000000493720.jpg,old time clock hangs out of corner of building in city
000000395083.jpg,A grassy tree filled field with a lot of kites in the air.
000000558013.jpg,Various kites flying in the wind with the beach in the background
000000369533.jpg,Light breaks through a cloudy day at the pier.
000000217919.jpg,An old clock tower with a bell on a cloudy day.
000000027208.jpg,A number of fanciful kites are being flown above a wide beach.
000000552866.jpg,A photograph-like illustration of a city night scene.
000000261026.jpg,A large white clock tower sitting in the middle of a city.
000000274779.jpg,A crowded city street line with tall buildings.
000000054335.jpg,A lady looks out onto the city from behind a giant clock.
000000398753.jpg,A view of a baseball game during the day.
000000182483.jpg,Tower clock made of rock set against a cloudy sky.
000000453273.jpg,A large pot of flowers and a view of a cemetery. 
000000279984.jpg,A lady walking in a grassy area holding a kite. 
000000274939.jpg,A clock mounted on a poll near a city street sign.
000000514529.jpg,A para-sailor is seen on the ocean in the distance. 
000000216398.jpg,a tall clock tower with a sky in the background
000000109894.jpg,a clock on a pole on a city street near buildings
000000403180.jpg,a clock tower near a city street and buildings
000000327917.jpg,Wind surfer riding on a large green kite in the water. 
000000070190.jpg,A row of seats have closed off a stairwell.
000000224542.jpg,a truck is parked with a wind sail
000000342800.jpg,A large group enjoying a park beneath a cloudy sky.
000000400166.jpg,A closeup view of a mouse and keyboard connected to a desktop computer.
000000145956.jpg,a large clock tower towering above a city under a cloudy blue sky.
000000452881.jpg,We see a low angle view of a cluttered desk top.
000000217951.jpg,A surfer wrangles a parachute with a scenic mountain background.
000000153865.jpg,Big balloons and kites being flown on a beach.
000000070791.jpg,A surfer stands in knee high water in the ocean.
000000124018.jpg,A sky view looking at the clock tower of a building.
000000214527.jpg,A clock is high up on a large city structure.
000000150309.jpg,THERE IS A TOWER CLOCK IN THE CITY
000000005502.jpg,Kites fly in the cloudy sky over a large grass area.
000000381699.jpg,some snow decorations and a clock on a steeple 
000000263412.jpg,Several houses are being viewed from the street.
000000260927.jpg,A fish-eye view of a statue in front of a columned building.
000000365485.jpg,A city with lots of tall buildings and a massive blue clock tower.
000000050965.jpg,"a building with wind vane on top, and a clock in middle"
000000372914.jpg,A giant massive clock tower towering over a city.
000000335194.jpg,A busy ocean pier with several kites in flight.
000000218119.jpg,A crowd gathers on a beach and flies kites.
000000347039.jpg,A clock tower stands over a city landscape.
000000438535.jpg,An analog clock on a post in a city.
000000485740.jpg,A crowd in a city on a sunny day
000000202622.jpg,A vertical view of of a tower reveals a clock and a flag.
000000459999.jpg,A large clock tower towering over a city.
000000359436.jpg,A kite flyer stand on a beach with a mountain of trees behind her. 
000000372150.jpg,The Big Ben clock tower underneath a cloudy blue sky.
000000474402.jpg,The Big Ben clock tower towering over the city of London.
000000271934.jpg,A view from the bottom on a church looking up towards the dark sky.
000000535307.jpg,A sandy beach next to the ocean under a sky filled with kites.
000000369506.jpg,A tall church tower under a blue sky filled with white fluffy clouds.
000000156567.jpg,A black clock tower with a white sky in the background.
000000519471.jpg,A laptop computer set up at a table overlooking a busy seating area. 
000000421865.jpg,A group of kites being flown at the beach.
000000132136.jpg,The sky is full of colorful kites in varying sizes.
000000435692.jpg,Kites flying in cloudy sky over the ocean.
000000578655.jpg,A empty ocean surf with a parachute in the background.
000000386638.jpg,Beach goers enjoying a sunny day in the sand and surf.
000000406959.jpg,An elaborate lamp post clock in a city
000000306127.jpg,Large projection screen in use while audience watches from their seats.
000000113606.jpg,A black kit flies in the sky over a body of water and hills are in the background.
000000155380.jpg,a tower on top of a building with a sky background
000000019247.jpg,There is a wakeboarder flying a kite in the ocean
000000367599.jpg,There are a bunch of kites flying on a beach.
000000324914.jpg,A close up view of a sleek computer keyboard on a desk.
000000408253.jpg,A lady in walking on the beach with a confused look on her face.
000000497299.jpg,family fun at the beach flying a kite
000000111435.jpg,Picture of a clock tower on a blue sky day.
000000533173.jpg,A number of kites flying in the sky above the sand.
000000429033.jpg,A view of an open laptop being used in and auditorium.
000000250571.jpg,A kite flying over the ocean in a blue sky.
000000343599.jpg,A tall clock tower behind some snow covered trees.
000000237464.jpg,Variety of clouds flown on semi crowded beach.
