file_name,caption
000000143717.jpg,Wide shot of a beach resort with a pool.
000000345042.jpg,A large boat is against a sand bar in the water.
000000350621.jpg,Tables and beach chairs are under umbrellas on a deck.
000000554505.jpg,"Lounge chairs with an umbrella, at a beach."
000000097023.jpg,"City street scene, with snow and rain mix falling."
000000193808.jpg,A beach area with umbrellas and padded lounge chairs at dusk.
000000164428.jpg,A multi-colored umbrella and a striped umbrella at the beach.
000000202522.jpg,Several boats docked in a big blue sea.
000000127991.jpg,A small boat floating in a lake next to a shore.
000000011805.jpg,An outdoor bazaar on an open city street.
000000215534.jpg,A stand of flowers is in the grass under an umbrella.  
000000418270.jpg,It's fun to have a picnic under an umbrella at the beach.
000000457016.jpg,A green umbrella sitting on top of beach next to the ocean.
000000326948.jpg,A cityscape with a marina with boats and a pier.
000000006421.jpg,A large cruise ship traveling near a beach on crystal blue water.
000000160402.jpg,A large boat travels through the water near the mountains.
000000033813.jpg,A bunch of boats gathered in a lake. 
000000580200.jpg,A beach covered in bamboo umbrellas next to the ocean.
000000063217.jpg,A boat sitting in a river with a cityscape in the background.
000000537064.jpg,A lighthouse stands on the edge of a pier near the ocean.
000000546940.jpg,A group of friends sitting under umbrellas on a beach.
000000170968.jpg,a close up of luggage bags on a grassy ground
000000566979.jpg,A row of umbrellas sitting on top of a sandy beach.
000000152275.jpg,A dock with a boat next to it out on a lake.
000000427920.jpg,a pair of beach chairs perched under a sun shade.
000000321066.jpg,A sailboat sailing across the top of a lake.
000000345944.jpg,A canal going through a city filled with boats.
000000466713.jpg,A view of the sunset on the ocean.
000000447228.jpg,A large wooden ship sailing across a lake.
000000178966.jpg,A beach filled with docked boats next to the ocean.
000000298318.jpg,"Wide river in city with boat traffic, near bridge."
000000336081.jpg,A fishing boat is parked on a trailer near a lake.
000000502152.jpg,He is watching the sky on the deck of the boat.
000000234624.jpg,The traffic is coming down the city street as the pedestrians cross in front of them
000000139653.jpg,An open pink umbrella sitting on top of a beach.
000000018535.jpg,colorful umbrellas and chairs in the sand on a beach
000000224083.jpg,A colorful umbrella sitting next to the ocean.
000000315324.jpg,A small covered boat sitting in a lake channel.
000000144357.jpg,A group of colorful umbrellas flying in a sky above a city.
000000502724.jpg,A beach covered with lawn chairs and umbrellas.
000000581571.jpg,A red umbrella sitting on top of a beach.
000000428440.jpg,An elegantly decorated water vessel sitting on the sand near the water.
000000300307.jpg,A boat floating on top of a river next to a forest.
000000456792.jpg,A white boat floating on a lake with clear water.
000000327450.jpg,A ship is parked in a waterway as clouds approach.
000000343752.jpg,A Coast Guard boat passing a pier as it heads out to sea.
000000413996.jpg,Large ships sit in the ocean near the dock.
000000297581.jpg,A colorful array of small umbrellas are hanging on trees in a forest.
000000409134.jpg,A statue holding a umbrella in a courtyard in the city. 
000000172377.jpg,Lady sitting under a umbrella on the beach.
000000224371.jpg,Several beach chairs and a closed umbrella surround a serene swimming pool.
000000258264.jpg,A beach filled with lawn chairs and blue and white umbrellas.
000000324669.jpg,A boat traveling on a lake filled with water.
000000081903.jpg,This is a black and white night scene of a city in the rain.
000000454408.jpg,There are chairs with umbrellas on a beach.
000000268037.jpg,A Corgi leaps over an obstacle in a sand area.
000000121651.jpg,A large building next to a lake .
000000555037.jpg,Several large boats docked at a pier on a cloudy day.
000000295310.jpg,Red and white boat on a lake during daytime.
000000122923.jpg,Part of a ship sits in the shallow end of the bay next to a city.  
000000485755.jpg,A beach with an area with umbrellas and an open area without them.
000000575246.jpg,A black and red boat is on the ocean and in the background are lots of other boats.
000000030588.jpg,rows of standing umbrellas on the sand next to the ocean.
000000443650.jpg,A lake with tied up boats floating in the water.
000000507615.jpg,a black umbrella open and laying on the grass 
000000263968.jpg,The view from under a tiki hut is serene.
000000072354.jpg,Colorful umbrellas line a beach as the water is also lined with swimmers.
000000478823.jpg,Debris floats in the water next to the lake shore.
000000505686.jpg,Winter scene overlooking drifting snow and a stopped vehicle.
000000449138.jpg,A boat floating out on water in the middle of a lake.
000000215474.jpg,A boat sailing across a lake next to small boats.
000000296419.jpg,A sail boat floating across a lake surrounded by forest.
000000136323.jpg,Several large boats parked in a harbor off the ocean.
000000470532.jpg,A lady with a pink umbrella in the rain in the city.
000000344644.jpg,WEDDING TAKING PLACE ON A WHITE SANDY BEACH
000000477310.jpg,A buoy in the ocean with hazy skies and a sailboat. 
000000521203.jpg,A sail boat sails along in the ocean. 
000000275130.jpg,A hot summer day on a sandy beach.
000000267022.jpg,Yellow lounge chairs with umbrellas lined up on grassy field.
000000469834.jpg,A bunching of umbrellas with the blue sky in the background.
000000533677.jpg,A group of boats floating on top of a lake.
000000316928.jpg,A busy city with a stream of water containing several boats
000000464075.jpg,Four beached river boats tethered next to each other. 
000000202050.jpg,A blue and gray Chicago police boat patrolling the ocean.
000000066234.jpg,The boats have been beached long enough to be overgrown.
000000115126.jpg,A black and white photo of a very crowded tropical beach.
000000345216.jpg,A lighthouse is shown on an island in the ocean.
000000118581.jpg,A view of a beach with closed umbrellas at sunset.
000000356029.jpg,a number of lawn chairs on a beach under some umbrellas
000000520486.jpg,An outdoor seating dining area has tabletop umbrellas.
000000312450.jpg,A puppy lays in the grass holding a Frisbee in its mouth. 
000000207998.jpg,A multilevel boat on river with city skyline in the background.
000000305254.jpg,It's a black and white photo of a street corner in a large city.
000000412848.jpg,A small sail boat floats on a water way by a city.
000000253944.jpg,A boat docked next to pier in a city.
000000581909.jpg,Several deserted boats digging in a grassy field.
000000048797.jpg,A busy beach is near the ocean while a red paragliding kite is in the sky over the water.
000000519186.jpg,A small barge is docked in a city port. 
000000232889.jpg,A large boat in the water near a city.
000000216406.jpg,A beach in front of some tall buildings with beach-goers sitting under bright umbrellas or on towels
000000485696.jpg,A sailboat on a lake in front of a small lighthouse.
000000365284.jpg,An aerial view of outdoor diners at wooden tables. 
000000065301.jpg,A rusted red and white boat on grass next to a fence.
000000045314.jpg,There are ships docked on the city's waterfront.
000000370466.jpg,Some boats on a lake with houses 
000000351431.jpg,A house on top of a small island in the middle of lake
000000391910.jpg,A row of beach chairs with umbrella's above them on the beach.
000000491733.jpg,A boat of some sort near a beach and a harbor.
000000051156.jpg,Four umbrellas lying down a beach during the day.
000000161093.jpg,A beach covered in lawn chairs covered in straw umbrellas.
000000246940.jpg,A boat floating on top of a lake next to a shoreline.
000000083770.jpg,A city street in the rain with the sun poking out.
000000223754.jpg,The city has a lot of foot traffic during this time of day. 
000000305425.jpg,A crowded open market is in a large city.
000000260955.jpg,A boat in the water on a cloudy day.
000000198930.jpg,A yacht in the water near some mountains.
000000336234.jpg,A black boat on water next to line of mountains.
000000410305.jpg,A row of beach chairs and umbrellas near the water.
000000341981.jpg,There is a line of blue umbrellas on a beach
000000275976.jpg,A view from a boat traveling on water near a forest.
000000186018.jpg,lots of blue and white umbrellas on the beach
000000500861.jpg,A long boat in the middle of an ocean.
000000289575.jpg,Thatched umbrellas rest on their tops in a sandy area.
000000061729.jpg,A street at night when the sky is very dark.
000000317804.jpg,A brightly colored umbrella held in an otherwise black and white forest.
000000193451.jpg,An image of the beach devoid of activity.
000000384507.jpg,A large body of water next to a mountain range.
000000061338.jpg,Beach scene with beach chairs and straw umbrellas.
000000316003.jpg,A small white boat in the water on the beach.
000000389729.jpg,A clock affixed to a building on a city street.
000000524613.jpg,a river view with boats on the dock
000000571575.jpg,Brass band under a tree at a grassy field.
000000117781.jpg,A large grouping of boats on in an asiancanal city with umbrellas.
000000342757.jpg,A black and white ship sailing in the sea.
000000580660.jpg,A white boat sits in the middle of a lake.
000000182147.jpg,Boats parked on a sandy beach under a cloudy sky. 
000000208961.jpg,A shoe sitting on the sand next to the ocean.
000000144734.jpg,A sandy beach covered in lawn chairs and umbrellas.
000000073496.jpg,A body of water next to a city with various buildings.
000000268523.jpg,A view of several boats in the water and machinery. 
000000543612.jpg,Looking down at the boat yard and dock area in a city
000000317563.jpg,A bunch of blue and yellow table umbrellas in a city.
000000580843.jpg,A brown suitcase resting on seats and a pair of shoes.
000000067344.jpg,Boats parked along a dock and others in the water in a city scene.
000000425752.jpg,Pedestrians cross the street in front of a majestic building in the city.
000000455719.jpg,several ladies wearing bikinis sunning on a beach 
000000237002.jpg,a beach filled with some colorful umbrellas and boats 
000000155118.jpg,A small fishing boat in the ocean .
000000055206.jpg,A family fishing from a boat on a lake.
000000478005.jpg,A grass area with cocktail umbrellas all over it.
000000179603.jpg,Yellow puppy with frisbee playing in grassy yard
000000247451.jpg,A row of boats on water with sky in background.
000000434016.jpg,Rustic city with crumbling walls and staircase and floor
000000063321.jpg,sailboats are out on the blue water under a cloudy sky.
000000322297.jpg,A busy beach with rainbow umbrellas planted in the sand
000000223095.jpg,A sandy beach covered in lay chairs and umbrellas.
000000492214.jpg,A group of boats floating on top of a lake.
000000128027.jpg,A row of boats parked in harbor with cloudy sky in background.
000000261323.jpg,A small boat and a large boat on a river near a city.
000000452465.jpg,Boats are lined-up in the sea on a cloudy day.
000000087249.jpg,A brown of lawn chairs sitting on to of a sandy beach.
000000148184.jpg,Small suitcases sitting next to a graffiti wall in the city. 
000000058997.jpg,A dock filled with boats in a lake during a sunset
000000421775.jpg,Some expensive looking boats are docked in a lake.
000000517656.jpg,"The suitcase is full sand, and is washed up on the beach."
000000115299.jpg,An thatch umbrella on a beach has a blue post.
000000133549.jpg,A beach shore with a shallow strip of water passing through it.
000000070871.jpg,Dark stormy clouds and picture of sailboats parked in the harbor.
000000206137.jpg,Looking down a popular beach by a hotel
000000074114.jpg,A surfboard rental sign on a surfboard in the beach sand
000000007819.jpg,A very wet city street lined with parked cars
000000423964.jpg,A boat passes under an archway on canal through a quaint old city.
000000535165.jpg,A beautiful view of the water and land behind it
000000380284.jpg,Grass roofed umbrellas on a bay with cliffs
000000134590.jpg,A lush green palm tree forest next to a dirt field.
000000172062.jpg,A lady on the beach with a colorful umbrella. 
000000406342.jpg,A boat sitting next to a blue boat on a sandy shore.
000000503074.jpg,A large wooden boat next to white stairs in grassy field.
000000482954.jpg,An army boat with soldiers on it in the ocean. 
000000424718.jpg,A blue and cloudy sky full of kites.
000000202657.jpg,The umbrellas are protecting the beach goers from the sun.
000000221805.jpg,a boat floating by in the water on a cloudy day
000000418653.jpg,A boat is on a lake with a forest surrounding it.
000000334393.jpg,boats attached to the docks on a slightly cloudy day
000000527562.jpg,A small boat near another floating vessel in the ocean.
000000324428.jpg,A group of boats floating on top of a river near a city.
000000129142.jpg,Recreational boats are docked on a glass-still park lake. 
000000089582.jpg,The coast guard sets out in search of any vessels in distress.
000000155763.jpg,A large ferry swims across a lake with a mountain in the background.
000000041728.jpg,Dock area with urban area on cloudy day.
000000075352.jpg,Lots of boats on the water in the middle of a city.
000000123799.jpg,"A beach with a pair of lounge chairs under an umbrella in the sane, in front of the water."
000000506898.jpg,some white lounge chairs and umbrellas on the sand and water
000000458866.jpg,A boat traveling in the middle of the ocean.
000000381694.jpg,The street is filled with an endless sea of umbrellas.
000000238004.jpg,a ship and crew parked near the sand in the water
000000554852.jpg,A beach covered in lots of lawn chairs and umbrellas.
000000317672.jpg,a red umbrella laying in the grass 
000000523468.jpg,Umbrellas are lining a beach in rows by the sea.
000000166076.jpg,Chairs and a umbrella that are on the beach in the sand.
000000099956.jpg,A cloudy sky is shown in a black and white photo.
000000312661.jpg,Boat with staff on water with city in background
000000043933.jpg,A trio of ships sit anchored on a beach.
000000578317.jpg,A scene of a crowded harbor against a backdrop of a city skyline.
000000487665.jpg,A river going through the middle of a city filled with boats.
000000236217.jpg,A large sign is lit up on a dark city street.
000000528555.jpg,Lounge chairs are on the sand under an umbrella at the beach
000000275406.jpg,A boat floating along a body of water near mountains.
000000082679.jpg,a aerial view of a town with docks and boats
000000197305.jpg,Tables and umbrellas situated on a grassy meadow.
000000210812.jpg,A night view of boats and a skyline in the background.
000000366501.jpg,Old Glory is on the beach with the others relaxing. 
000000176763.jpg,Sailboats anchored in waterway with mountains in background.
000000135338.jpg,A row of lawn chairs covered with umbrella on a sandy beach.
000000352523.jpg,some boats in the water some buildings and hills
000000160085.jpg,"A white beach chair with a red, white and blue striped towel under a yellow umbrella. "
000000562573.jpg,A black and white photo of a mountain view area on a rainy day.
000000466054.jpg,This composite shows 6 views of luggage handling in the airport and the use of luggage carriers.
000000119808.jpg,A direction sign is next to a city building.
000000556591.jpg,A very snowy roof top near some pretty decorations on poles.
000000119214.jpg,A crowded city street on a cloudy day 
000000578453.jpg,Boats in the water with mountains in the background. 
000000225127.jpg,An umbrella in the sand on a beach. 
000000157314.jpg,A blue umbrella sits on top of a black trashcan on a city street.
000000506653.jpg,Little paddle boats painted with bright colors are at a dock and on the shore of a lake.
000000310085.jpg,A bottle of beer on a chair under an umbrella at the beach.
000000123800.jpg,A group of ships out in the ocean.
000000001216.jpg,A bridge in a city park with flowers growing all around it. 
000000091440.jpg,A very tall mountain sitting right next to a beach in the ocean.
000000118407.jpg,A boat sailing in the water across the ocean
000000006004.jpg,A large ship in a dock area of the ocean 
000000245846.jpg,Chaise lounges and umbrellas on a beach at the ocean 
000000290331.jpg,Large navy vessel docked near wall on waterway in city.
000000577582.jpg,"Watercraft in a row, floating on the calm ocean."
000000423906.jpg,A pair of boats stacked up on a beach.
000000537910.jpg,Several canoes parked in the grass on the shore of a lake 
000000131374.jpg,Friends having a BBQ on the beach under a cluster of sun umbrellas
000000159656.jpg,A large body of water sitting next to trees in a  forest.
000000334477.jpg,A view of a pine tree from under a screen.
000000408779.jpg,A row of parked boats sitting on top of a beach.
000000160906.jpg,It looks like storm clouds in this photo.
000000561551.jpg,A boat sitting on top of a sandy beach.
000000208144.jpg,A small boat going down a lake with a lighthouse in the back.
000000039236.jpg,a number of different clothing on the ground at a beach
000000011658.jpg,A group of small boats sail out on a lake by some hills.
000000512557.jpg,A run down rusted up boat sitting in a forest.
000000526648.jpg,A boat sailing across a lake next to a forest.
000000065776.jpg,A view of a bunch of luggage sitting on the curb at the airport.
000000391333.jpg,A picture of a big boat going out to sea.
000000466070.jpg,A bunch of boats floating in the water in the ocean. 
000000009745.jpg,Speed boats are splashing through the water near a large city.
000000459673.jpg,A river moving along a city filled with buildings.
000000533231.jpg,A red boat sitting on top of a lake.
000000328039.jpg,A sailboat without mast is on a calm sea
000000173870.jpg,A boat in the ocean passing by a light house on shore.
000000441650.jpg,A rainbow type umbrella with a grassy mountaineous area in the background
000000319322.jpg,the umbrella is sitting the the snow bank on the road
000000180713.jpg,A purple suitcase with a pink beach towel and a stuffed squirrel.
000000467308.jpg,The sail boats are tied to the grassy shore.
000000038198.jpg,A briefcase placed on driver's seat of a car
000000092585.jpg,A boat in the ocean with a lot of stuff in it.
000000541299.jpg,A red umbrella and white beach chair on the shore of a turquoise sea
000000550097.jpg,a rusty boat sitting in the water of a lake 
000000302343.jpg,A few boats sitting on top of a river next to a forest.
000000307158.jpg,Several boats are seen against the backdrop of majestic mountains.
000000430114.jpg,A view of a rainbow over a city from a picnic bench.
000000426007.jpg,a ship sailing the ocean near a big city
000000202762.jpg,A sandy beach with lots of umbrellas on top of it.
000000128922.jpg,A sail boat out in the sea with a few other types of boats
000000216694.jpg,A white lawn chair laying on top of a sandy beach.
000000121032.jpg,A boat is sailing down the still water of the lake.
000000168848.jpg,A view of fishing boats in the water at the moorage.
000000289158.jpg,There is a giant umbrella decoration on the city streets. 
000000349129.jpg,a small row boat is being pushed on a lake
000000392145.jpg,A bunch of lawn chairs sitting on top of a beach.
000000002623.jpg,Row boats moored at a pier on a lake surrounded by mountains.
000000075243.jpg,A small ship on calm water surrounded by mountains.
000000035002.jpg,A large colored umbrella is seen against the backdrop of the ocean.
000000215469.jpg,a shopping mall with thousands of umbrellas suspended from the ceiling
000000199157.jpg,A large white and blue boat traveling along a large mountain.
000000335144.jpg,The table is set up with an umbrella at the beach.
000000164000.jpg,A number of boats in the sea anchored at the bay
000000107979.jpg,A sea with boats anchored at the bay
000000027777.jpg,A large red and blue boat sitting on top of a lake next to other boats.
000000560713.jpg,A boat anchored at the bay in the sea waters
000000508065.jpg,A small boat traveling across the ocean under a blue sky.
000000187012.jpg,A lady walking down a city street on a rainy day. 
000000119594.jpg,A line of boats and ferries on a body of water near a city.  
000000553370.jpg,A large boat near a small boat in the ocean. 
000000376524.jpg,A large black and white stripe umbrella on a beach.
000000554668.jpg,A bunch of boats floating out in the sea next to each other.
000000145290.jpg,A grass umbrella planted in sand marked by vehicle tracks.
000000558600.jpg,A small sailboat has just sailed under a bridge across a lake.
000000440177.jpg,A group of chairs and umbrellas on a beach.
000000198022.jpg,Small pleasure boats docked  near rural homes at lake.
000000190646.jpg,Looking down at hand luggage sitting on a car seat
000000473190.jpg,There are a lot of boats out at sea.
000000494079.jpg,"A backyard area that has an outdoor table, umbrella and chairs, set on an grass lawn with a wooden fence enclosing the yard area."
000000574562.jpg,A traveler with her luggage walking under an umbrella on a city street
000000272255.jpg,Looking down at pedestrians under umbrellas on a city street
000000238828.jpg,A teenager is sitting on a chair at the beach.
000000310671.jpg,Chairs and an umbrella in the sans at the beach.
000000048165.jpg,a boat in the water some buildings and hills
000000268642.jpg,A light house sitting next to a house on top of a hill.
000000368896.jpg,A beach lined with lots of blue and white umbrellas.
000000143941.jpg,Beach chairs and umbrellas set up with view of open ocean.
000000194362.jpg,The is am umbrella and a bag on the beach.
000000164850.jpg,Blue umbrella above railing on partly cloudy day.
000000341612.jpg,several white boats in the dock in the ocean
000000474785.jpg,The chairs on the beach by the water are empty.
000000183921.jpg,A blue boat traveling on top of a lake next to other boats.
000000340222.jpg,The Golden Gate bridge in the city of San Francisco.
000000044483.jpg,A river traveling past a city with lots of tables with umbrellas.
000000415523.jpg,A very pretty beach with some small boats docked.
000000544396.jpg,A white boat on water next to buildings with sky in background.
000000122936.jpg,a small black beer hiding in a grassy area on a hill
000000478670.jpg,a panda is roaming the landscape of its origin
000000455508.jpg,Yachts and boats tied to an ocean pier.
000000320788.jpg,A full view of suitcases with some clothes on it. 
000000380280.jpg,"A view of what looks like a hotel lobby, there is lots of luggage."
000000290600.jpg,A full view of a tall building and a white car. 
000000029268.jpg,A full view of some umbrellas with different colors. 
000000384960.jpg,The view of a pier throw rain covered window.
000000420976.jpg,A ferry makes its way to port in a city..
000000440439.jpg,A boat traveling down a river surrounded by forest.
000000245221.jpg,A large body of water sitting below a mountain with lots of sail boats on it.
000000122844.jpg,A fishing boat sits washed up on the beach.
000000117935.jpg,a small white boat is at the beach
000000516189.jpg,There is a SUV truck parked out in the desert range if the grass in the safarga
000000416279.jpg,A buoy near a tug boat pulling a barge in the ocean.
000000061184.jpg,A balcony with a hot tub overseeing the ocean.
000000162216.jpg,A forest has an umbrella laying on a bunch of leaves
000000098232.jpg,A beach line with lots of boats next to a lake.
000000495433.jpg,A marine filled with lots of boats under a cloudy sky.
000000395740.jpg,"A small, outdoor group of tables on the corner of a city street."
000000564411.jpg,"Here is an outdoor view of the area.
"
000000348621.jpg,Boats are lined up in the harbor by a city.  
000000402073.jpg,A GROUP OF ROWERS IN THEIR CANOE ON THE LAKE
000000022767.jpg,a small piece of grass is on a silver case
000000166179.jpg,Four boats navigating a river by a waterfall.
000000321338.jpg,A sail boat sits in the water near a beach and pier
000000170069.jpg,a boat is moving out in the ocean
000000388171.jpg,A ship sailing along the ocean with steam pouring out of it's smoke stacks.
000000030381.jpg,This is an illustration of a mammoth in a mountainous area.
000000183790.jpg,A busy city street with pedestrians and buses in the background.
000000104768.jpg,Blue sky and blue water with a sailboat approaching a bridge 
000000308349.jpg,A sandy beach topped with lawn chairs and umbrella.
000000362509.jpg,A beach umbrella sitting in front of the sun.
000000285710.jpg,A plethora of boats sitting in the ocean just off the shore.
000000355674.jpg,Busy beach with lounge chairs and umbrellas and clear blue water.
000000449657.jpg,Beach goers enjoying sunny day on sandy beach at ocean.
000000545053.jpg,some boats a dock water clouds and a building
000000442686.jpg,a bunch of open yellow umbrellas sitting on the grass 
000000521232.jpg,An outdoor seating section that overlooks a body of water
000000379955.jpg,Beach umbrellas and a flag in a sandcastle mark the beach where families play.
000000207770.jpg,A lake sitting under a mountain next to a forest.
000000024181.jpg,An old retail building on a street corner in a city.
000000305710.jpg,Pedestrians in an Asian city across the street from a restaurant.
000000275292.jpg,A lot of small boats floating on top of a lake.
000000496953.jpg,A boat travels down the river of a city. 
000000023283.jpg,A suitcase sitting on a rack or seat by itself
000000459471.jpg,Chairs and umbrellas set out on a nice beach. 
000000080401.jpg,A large body of water surrounded by a mountain range.
000000479103.jpg,An older fishing boat cruises across the water with a beach town and mountains in the background.
000000271122.jpg,A group of wooden structures stand in front of a hill.
000000193972.jpg,A boat traveling on the water in front of mountains.
